{
  "id": "US-45.5",
  "title": "Merge executor: a GitHub App squashes the allowed checkpoint by compare-and-swap",
  "epic": {
    "id": "epic_45",
    "name": "Change Threads"
  },
  "priority": "critical",
  "phase": "change_threads",
  "story": {
    "as_a": "loopctl control plane",
    "i_want_to": "merge an allowed checkpoint to the base branch myself",
    "so_that": "the merged tree is exactly the tree the gate allowed, with no pull request and no stale head"
  },
  "rationale": "PRD \u00a74 item 3 and 4.",
  "acceptance_criteria": [
    {
      "id": "AC-45.5.1",
      "description": "ThreadMergeWorker is unique per story and runs only on a recorded allow for the checkpoint it merges."
    },
    {
      "id": "AC-45.5.2",
      "description": "It reads the commit's tree from the forge by commit_sha and refuses with tree_mismatch, escalating, when it differs from the recorded tree_sha; otherwise it verifies the checkpoint contains the base head, creates the squash commit with that tree and the base head as parent, records merge_commit_sha, and only then updates the ref with force false."
    },
    {
      "id": "AC-45.5.3",
      "description": "A retry whose recorded merge_commit_sha is an ancestor of the base head answers already_merged and moves the story to merged."
    },
    {
      "id": "AC-45.5.4",
      "description": "A non-fast-forward refusal merges the base into the thread branch as the App and records a base_update checkpoint through a control-plane function that has no HTTP route and bypasses the claimant fence; the story stays at ci over base_updated. A merge conflict returns it to implementing over base_moved."
    },
    {
      "id": "AC-45.5.5",
      "description": "The squash message carries the story id, a one-line printable title, the thread URL and a Loopctl-Story trailer, and no entry body."
    },
    {
      "id": "AC-45.5.6",
      "description": "The App's credentials are new environment variables documented in deploy/FLY_SECRETS.md; with them unset the worker refuses and escalates rather than merging."
    },
    {
      "id": "AC-45.5.7",
      "description": "The stage machine has a ci to ci base_updated edge taken only for a base_update checkpoint the control plane recorded, whose first parent is the checkpoint the gate last allowed and whose tree is GitHub's clean merge of the base into it. The edge replaces head_sha with the base_update SHA and clears merge_gate_allowed_sha, keeps the story's review verdict and custody binding, and does not send the story to implementing; any other head movement still goes over base_moved. The edge must not allow a base_update head until US-45.6's CI evidence for that exact SHA is green. (Moved from US-45.4, where it was AC-45.4.4.)"
    }
  ],
  "test_cases": [
    {
      "id": "TC-45.5.1",
      "verifies": [
        "AC-45.5.2",
        "AC-45.5.3"
      ],
      "name": "lost acknowledgement",
      "type": "integration",
      "preconditions": [
        "mocked forge"
      ],
      "steps": [
        "ref update succeeds, ack lost, retry"
      ],
      "expected_results": [
        "already_merged"
      ]
    },
    {
      "id": "TC-45.5.2",
      "verifies": [
        "AC-45.5.4"
      ],
      "name": "moved base",
      "type": "integration",
      "preconditions": [
        "mocked forge"
      ],
      "steps": [
        "non-fast-forward then clean base merge"
      ],
      "expected_results": [
        "base_update checkpoint; story at ci"
      ]
    },
    {
      "id": "TC-45.5.3",
      "verifies": [
        "AC-45.5.5"
      ],
      "name": "message",
      "type": "unit",
      "preconditions": [],
      "steps": [
        "build message with a hostile title"
      ],
      "expected_results": [
        "one printable line; no entry text"
      ]
    },
    {
      "id": "TC-45.5.4",
      "verifies": [
        "AC-45.5.6"
      ],
      "name": "unconfigured",
      "type": "integration",
      "preconditions": [],
      "steps": [
        "run without App env"
      ],
      "expected_results": [
        "escalated, no merge"
      ]
    },
    {
      "id": "TC-45.5.5",
      "verifies": [
        "AC-45.5.1"
      ],
      "name": "only on a recorded allow",
      "type": "integration",
      "preconditions": [],
      "steps": [
        "enqueue with no allow; with an allow on another checkpoint"
      ],
      "expected_results": [
        "no merge in either case"
      ]
    },
    {
      "id": "TC-45.5.6",
      "verifies": [
        "AC-45.5.2"
      ],
      "name": "tree mismatch",
      "type": "integration",
      "preconditions": [
        "mocked forge"
      ],
      "steps": [
        "recorded tree differs from the forge's"
      ],
      "expected_results": [
        "escalated with tree_mismatch; no ref update"
      ]
    },
    {
      "id": "TC-45.5.7",
      "verifies": [
        "AC-45.5.7"
      ],
      "name": "base_updated edge",
      "type": "unit",
      "preconditions": [],
      "steps": [
        "transition ci to ci over base_updated"
      ],
      "expected_results": [
        "allowed"
      ]
    },
    {
      "id": "TC-45.5.8",
      "verifies": [
        "AC-45.5.7"
      ],
      "name": "base_updated keeps review",
      "type": "integration",
      "preconditions": [
        "thread story allowed at checkpoint C"
      ],
      "steps": [
        "record a base_update merge of master into C; re-run the gate"
      ],
      "expected_results": [
        "story stays at ci; allow on the new head without a new review round"
      ]
    }
  ],
  "technical_notes": [
    "Forge access through a behaviour with a Mox mock in test.",
    "The base_update checkpoint is written by a control-plane function with no HTTP route, never through the claimant-fenced checkpoint endpoint."
  ],
  "dependencies": [
    "US-45.4",
    "US-45.6"
  ]
}
